{
  "artifact_count": 7,
  "artifacts": [
    {
      "artifact_id": "artifact_human_digital_twin_example",
      "artifact_type": "human_digital_twin",
      "digest": "sha256:0000000000000000000000000000000000000000000000000000000000000001",
      "media_type": "application/json",
      "path": "examples/human-digital-twin.example.json",
      "required": true
    },
    {
      "artifact_id": "artifact_consent_policy_example",
      "artifact_type": "consent_policy",
      "digest": "sha256:0000000000000000000000000000000000000000000000000000000000000002",
      "media_type": "application/json",
      "path": "examples/consent-policy.example.json",
      "required": true
    },
    {
      "artifact_id": "artifact_mission_example",
      "artifact_type": "mission",
      "digest": "sha256:0000000000000000000000000000000000000000000000000000000000000003",
      "media_type": "application/json",
      "path": "examples/mission.example.json",
      "required": true
    },
    {
      "artifact_id": "artifact_projection_example",
      "artifact_type": "projection",
      "digest": "sha256:0000000000000000000000000000000000000000000000000000000000000004",
      "media_type": "application/json",
      "path": "examples/projection.example.json",
      "required": true
    },
    {
      "artifact_id": "artifact_projection_decision_log_example",
      "artifact_type": "projection_decision_log",
      "digest": "sha256:0000000000000000000000000000000000000000000000000000000000000005",
      "media_type": "application/json",
      "path": "examples/projection-decision-log.example.json",
      "required": true
    },
    {
      "artifact_id": "artifact_capability_claim_event_example",
      "artifact_type": "capability_claim_event_log",
      "digest": "sha256:0000000000000000000000000000000000000000000000000000000000000006",
      "media_type": "application/json",
      "path": "examples/capability-claim-event.example.json",
      "required": true
    },
    {
      "artifact_id": "artifact_transition_receipt_example",
      "artifact_type": "transition_receipt",
      "digest": "sha256:0000000000000000000000000000000000000000000000000000000000000007",
      "media_type": "application/json",
      "path": "examples/transition-receipt.example.json",
      "required": true
    }
  ],
  "bundle_digest": "sha256:1111111111111111111111111111111111111111111111111111111111111111",
  "bundle_id": "bundle_example_alpha",
  "created_at": "2026-05-05T18:30:00Z",
  "custodian": "SocioProphet HolographMe",
  "purpose": "portable_governed_export",
  "schema_version": "0.1.0",
  "subject_id": "sub_example_alpha",
  "twin_id": "hdt_example_alpha"
}
